{
  "title": "Zustandsgebundene Rituale – Baseline",
  "description": "Dyadische Ritualisierung ohne soziales Gruppengedächtnis.",
  "seed": 23,
  "agents": 48,
  "zones": 4,
  "symbols": 5,
  "states": 4,
  "pulses": 8,
  "permeability": 0.005,
  "turnover_interval": 1200,
  "turnover_fraction": 0.125,
  "modules": {
    "valence": {
      "name": "intrinsic_2d",
      "params": {"attraction_ratio": 0.9, "social_scale": 0.035}
    },
    "geography": {
      "name": "porous_zones",
      "params": {"permeability": 0.005, "base_speed": 0.012}
    },
    "emission": {
      "name": "random_state_asymmetry",
      "params": {"scale": 0.8, "state_expression": true}
    },
    "inference": {
      "name": "pair_hmm",
      "params": {"learning_rate": 0.08, "stickiness": 0.72}
    },
    "practice": {
      "name": "compact_ritual",
      "params": {
        "learning_rate": 0.4,
        "policy_scale": 0.05,
        "imitation_strength": 1.0,
        "use_estimate": true,
        "use_previous_symbol": true
      }
    },
    "memory": {"name": "none", "params": {}}
  },
  "metadata": {
    "status": "reconstruction_for_visual_lab",
    "hypothesis": "Zustandsgebundene dyadische Routinen entstehen ohne Gruppengedächtnis.",
    "not_a_scientific_claim": true
  }
}
