{
  "title": "Kontrolle – sichtbare Sequenzimitation",
  "description": "Handlung folgt sichtbaren Vorgängersymbolen, nicht privaten Zustandsschätzungen.",
  "seed": 23,
  "agents": 48,
  "zones": 4,
  "symbols": 5,
  "states": 4,
  "pulses": 8,
  "permeability": 0.005,
  "turnover_interval": 1200,
  "turnover_fraction": 0.125,
  "modules": {
    "emission": {
      "name": "random_state_asymmetry",
      "params": {"scale": 0.8, "state_expression": false}
    },
    "practice": {
      "name": "compact_ritual",
      "params": {
        "learning_rate": 0.4,
        "policy_scale": 0.05,
        "imitation_strength": 1.0,
        "use_estimate": false,
        "use_previous_symbol": true
      }
    },
    "memory": {"name": "none", "params": {}}
  },
  "metadata": {
    "status": "control",
    "control_for": "visible_sequence_tradition"
  }
}
